{
  "templateId": "invoice-intake",
  "version": 1,
  "display": {
    "name": "Invoice intake",
    "description": "Receives invoice webhooks, holds large invoices for approval, and emails the outcome from your connected Gmail account.",
    "category": "Finance",
    "icon": "Receipt"
  },
  "pricing": {
    "monthlyPriceUsd": 0
  },
  "trigger": {
    "kind": "webhook"
  },
  "requiredConnections": [
    {
      "providerId": "google",
      "displayName": "Google",
      "purpose": "Tells the vendor their invoice was received, from your own Gmail account.",
      "scopes": ["https://www.googleapis.com/auth/gmail.send"]
    }
  ],
  "requiredCapabilities": [],
  "setup": [
    {
      "section": "rules",
      "key": "holdAboveAmount",
      "title": "Hold above",
      "description": "Invoices above this amount wait for someone to approve them. Editable anytime.",
      "control": "money",
      "defaultValue": 500,
      "required": false
    },
    {
      "section": "notifications",
      "key": "notifyEmail",
      "title": "Tell the vendor at",
      "description": "The vendor's accounts-receivable address. They are told their invoice was received once it is accepted, from your Gmail. Your own completion notice comes from Autom8x, not from here.",
      "control": "text",
      "required": true
    }
  ],
  "pipeline": [
    {
      "id": "receive",
      "kicker": "TRIGGER",
      "title": "Invoice received",
      "description": "A verified webhook delivery starts a run with the invoice to intake."
    },
    {
      "id": "validate",
      "kicker": "ACTION",
      "title": "Check the amount",
      "description": "Compares the invoice against your threshold and holds it if it is above."
    },
    {
      "id": "notify",
      "kicker": "ACTION",
      "title": "Tell the vendor",
      "description": "Confirms receipt to the vendor from your connected Google account."
    }
  ],
  "service": {
    "origin": "http://invoice-intake.autom8x.internal:8080",
    "serviceAccount": "invoice-intake@autom8x.iam.gserviceaccount.com",
    "contractVersion": 1,
    "maxConcurrentRuns": 40,
    "acceptTimeoutMs": 5000,
    "runTimeoutSeconds": 900
  },
  "outputSchema": {
    "type": "object",
    "properties": {
      "reference": {
        "type": "string"
      },
      "vendor": {
        "type": "string"
      },
      "amount": {
        "type": "number"
      },
      "decidedBy": {
        "type": "string"
      },
      "notified": {
        "type": "boolean"
      }
    },
    "required": ["reference", "vendor", "amount", "decidedBy", "notified"]
  }
}
