{
  "templateId": "invoice-check",
  "version": 2,
  "display": {
    "name": "Invoice check",
    "description": "Checks an invoice against your threshold, holds the large ones for someone to approve, and emails the outcome.",
    "category": "Finance",
    "icon": "Receipt"
  },
  "pricing": {
    "monthlyPriceUsd": 0
  },
  "trigger": {
    "kind": "manual"
  },
  "requiredConnections": [
    {
      "providerId": "google",
      "displayName": "Google",
      "purpose": "Sends the outcome of each check from your own Gmail account.",
      "scopes": ["https://www.googleapis.com/auth/gmail.send"]
    }
  ],
  "requiredCapabilities": [],
  "setup": [
    {
      "section": "rules",
      "key": "holdAboveAmount",
      "title": "Hold above",
      "description": "Invoices above this amount wait for someone to approve them. Editable anytime.",
      "control": "money",
      "defaultValue": 500,
      "required": false
    },
    {
      "section": "notifications",
      "key": "notifyEmail",
      "title": "Email the outcome to",
      "description": "Where each decided invoice is reported. Left empty, no email is sent.",
      "control": "text",
      "required": false
    }
  ],
  "pipeline": [
    {
      "id": "receive",
      "kicker": "TRIGGER",
      "title": "Invoice received",
      "description": "A run is started with the invoice to check."
    },
    {
      "id": "validate",
      "kicker": "ACTION",
      "title": "Check the amount",
      "description": "Compares the invoice against your threshold and holds it if it is above."
    },
    {
      "id": "post",
      "kicker": "ACTION",
      "title": "Record the invoice",
      "description": "Records the invoice once it is within threshold or has been approved."
    },
    {
      "id": "notify",
      "kicker": "ACTION",
      "title": "Email the outcome",
      "description": "Sends the decision from your connected Google account, when an address is set."
    }
  ],
  "service": {
    "origin": "http://invoice-check-v2.autom8x.internal:8080",
    "serviceAccount": "invoice-check-v2@autom8x.iam.gserviceaccount.com",
    "contractVersion": 1,
    "maxConcurrentRuns": 40,
    "acceptTimeoutMs": 5000,
    "runTimeoutSeconds": 900
  },
  "outputSchema": {
    "type": "object",
    "properties": {
      "reference": {
        "type": "string"
      },
      "vendor": {
        "type": "string"
      },
      "amount": {
        "type": "number"
      },
      "decidedBy": {
        "type": "string"
      },
      "notified": {
        "type": "boolean"
      }
    },
    "required": ["reference", "vendor", "amount"]
  }
}
